"Type","Title","Director","Cast","Country","Date_added","Release_year","Rating","Duration","Listed_in","Age","IMDb","Rotten.Tomatoes","Netflix","Hulu","Prime.Video","Disney","Rating_category","Age_years","Cross_platform_score","Overall_score"
"TV Show","Fugitiva","","Paz Vega, Julio Bracho, Arantza Ruiz, Luisa Rubino, Lander Otaola, Iván Pellicer, José Manuel Poga, Mercedes Sampietro, Charo López, Roberto Álamo, Raúl Medina, Melina Matthews, Pedro Mari Sánchez, Odiseo Bichir","Spain","November 23, 2018",2018,"TV-MA","1 Season","Crime TV Shows, International TV Shows, Spanish-Language TV Shows","18+","5.7/10","39/100",1,0,0,0,"High",6,0.25,0.48
"TV Show","Sick Note","","Rupert Grint, Nick Frost, Don Johnson, Lindsay Lohan, Pippa Bennett-Warner, Marama Corlett, Karl Theobald, Belinda Stewart-Wilson, Camilla Beeput, Dustin Demri-Burns, Tolu Ogunmefun","United Kingdom","November 23, 2018",2018,"TV-MA","2 Seasons","British TV Shows, International TV Shows, TV Comedies","18+","6.8/10","63/100",1,0,0,0,"High",6,0.25,0.655
"TV Show","Mystery Science Theater 3000: The Return","","Felicia Day, Patton Oswalt, Jonah Ray, Baron Vaughn, Hampton Yount","United States","November 22, 2018",2018,"TV-14","2 Seasons","TV Comedies, TV Sci-Fi & Fantasy","16+","8.0/10","64/100",1,0,0,0,"Medium",6,0.25,0.72
"TV Show","Kulipari: Dream Walker","","Charlie Adler, Mark Hamill, Jess Harnell, Phil LaMarr, Josh Keaton, Mikey Kelley, Amy Margolis, Wendie Malick, Kevin Michael Richardson, Candi Milo, Laraine Newman","","November 20, 2018",2018,"TV-Y7","1 Season","Kids' TV","all","7.6/10","34/100",1,0,0,0,"Low",6,0.25,0.55
"TV Show","The Final Table","","Andrew Knowlton","United States","November 20, 2018",2018,"TV-PG","1 Season","Reality TV","all","7.7/10","59/100",1,0,0,0,"Low",6,0.25,0.68
"TV Show","Eternal Love","","Yang Mi, Mark Chao, Dilraba Dilmurat, Ken Chang, Vengo Gao, Huang Mengying","China","November 17, 2018",2017,"TV-14","1 Season","International TV Shows, Romantic TV Shows, TV Dramas","7+","8.3/10","54/100",1,0,0,0,"Medium",7,0.25,0.685
"TV Show","La Doña","","Aracely Arámbula, David Chocarro, Danna Paola, Rebecca Jones, Odiseo Bichir, Gabriela Roel, Andrea Martí, Juan Ríos Cantú, Diego Soldano, Daniela Bascopé","United States, Mexico","November 17, 2018",2016,"TV-14","1 Season","Spanish-Language TV Shows, TV Dramas","16+","7.2/10","51/100",1,0,0,0,"Medium",8,0.25,0.615
"TV Show","Silvana Sin Lana","","Maritza Rodríguez, Carlos Ponce, Marimar Vega, Adriana Barraza, Marcela Guirado, Ricardo Abarca, Thali García, Alexandra Pomales, Briggitte Bozzo, Santiago Torres, Patricio Gallardo, Roberto Escobar, Samantha Dagnino, Raury Rolander, Vince Miranda, Javier Valcárcel","United States","November 17, 2018",2016,"TV-14","1 Season","Romantic TV Shows, Spanish-Language TV Shows, TV Comedies","16+","7.5/10","45/100",1,0,0,0,"Medium",8,0.25,0.6
"TV Show","Ponysitters Club","","Morgan Neundorf, Madeline Leon, Khiyla Aynne, Cailan Laine Punnewaert, Zyon Allen, Maya Franzoi, Victoria Tomazelli, Hugh Wilson, Diana Chrisman","Canada","November 16, 2018",2018,"TV-G","2 Seasons","Kids' TV, TV Dramas","all","7.1/10","33/100",1,0,0,0,"Low",6,0.25,0.52
"TV Show","Vai Anitta","","Anitta","Brazil","November 16, 2018",2018,"TV-MA","1 Season","Docuseries, International TV Shows, Reality TV","","5.5/10","35/100",1,0,0,0,"High",6,0.25,0.45
"TV Show","Warrior","","Dar Salim, Danica Curcic, Lars Ranthe, Marco Ilsø, Søren Malling, Jakob Oftebro","Denmark","November 13, 2018",2018,"TV-MA","1 Season","Crime TV Shows, International TV Shows, TV Dramas","","6.7/10","48/100",1,0,0,0,"High",6,0.25,0.575
"TV Show","Age of Tanks","","","Germany, France, Russia","November 10, 2018",2017,"TV-PG","1 Season","Docuseries, International TV Shows, Science & Nature TV","18+","7.3/10","44/100",1,0,0,0,"Low",7,0.25,0.585
"TV Show","Medal of Honor","","Oliver Hudson, Ben Schwartz, Paul Wesley, Aldis Hodge, Jonny Weston, Joseph Cross, Jake Abel, Derek Mio","United States","November 9, 2018",2018,"TV-MA","1 Season","Docuseries, TV Dramas","16+","8.4/10","55/100",1,0,1,0,"High",6,0.5,0.695
"TV Show","Super Drags","","Fernando Mendonça, Sérgio Cantú, Wagner Follare, Pabllo Vittar, Silvetty Montilla, Rapha Vélez, Sylvia Salustti, Guilherme Briggs","Brazil","November 9, 2018",2018,"TV-MA","1 Season","International TV Shows, TV Comedies","18+","5.6/10","47/100",1,0,0,0,"High",6,0.25,0.515
"TV Show","The Queen of Flow","","Carolina Ramírez, Carlos Torres, Andrés Sandoval, Adriana Arango, Mabel Moreno, Luis Alfredo Velasco, Pacho Rueda, Diana Wiswell, Mariana Garzón, Kiño, Sebastián Silva, Mariana Gómez, María José Vargas, Guillermo Blanco, Juan Manuel Restrepo, Alejandro Otero, David Ojalvo","Colombia","November 9, 2018",2018,"TV-MA","1 Season","Crime TV Shows, International TV Shows, Spanish-Language TV Shows","18+","7.8/10","53/100",1,0,0,0,"High",6,0.25,0.655
"TV Show","Treehouse Detectives","","Brody Allen, Jenna Davis, Ryan Bartley, Philece Sampler, Leigh Kelly, Abby Trott","South Korea, United States","November 9, 2018",2018,"TV-Y","2 Seasons","Kids' TV, TV Thrillers","","7.1/10","31/100",1,0,0,0,"Low",6,0.25,0.51
"TV Show","Westside","","","United States","November 9, 2018",2018,"TV-MA","1 Season","Reality TV","16+","6.2/10","42/100",1,0,1,0,"High",6,0.5,0.52
"TV Show","Transfers","","Arieh Worthalter, Brune Renault, Toinette Laquiere, Steve Tientcheu, Pili Groyne, Patrick Descamps, Patrick Raynal, Juliette Plumecocq-Mech, Sébastien Chassagne, Alexis Loret, Aissatou Diop","France, Belgium","November 8, 2018",2017,"TV-MA","1 Season","Crime TV Shows, International TV Shows, TV Sci-Fi & Fantasy","","7.3/10","54/100",1,0,0,0,"High",7,0.25,0.635
"TV Show","Damnation","","Logan Marshall-Green, Killian Scott, Sarah Jones, Chasten Harmon, Christopher Heyerdahl, Melinda Page Hamilton, Joe Adler","United States","November 7, 2018",2017,"TV-MA","1 Season","Crime TV Shows, TV Dramas","18+","7.7/10","65/100",1,0,0,0,"High",7,0.25,0.71
"TV Show","Brainchild","","Sahana Srinivasan, Alie Ward, Ben Seidman","","November 2, 2018",2018,"TV-G","1 Season","Kids' TV","7+","8.1/10","47/100",1,0,0,0,"Low",6,0.25,0.64
"TV Show","Follow This","","John Stanton, Scaachi Koul, Azeen Ghorayshi, Bim Adewunmi, Juliane Loffler, Charlie Warzel","United States","November 1, 2018",2018,"TV-MA","3 Seasons","Docuseries","18+","4.9/10","42/100",1,0,0,0,"High",6,0.25,0.455
"TV Show","Terrorism Close Calls","","","United States, Czech Republic","October 26, 2018",2018,"TV-MA","1 Season","Crime TV Shows, Docuseries, International TV Shows","","5.2/10","40/100",1,0,0,0,"High",6,0.25,0.46
"TV Show","Great News","","Briga Heelan, Andrea Martin, Adam Campbell, John Michael Higgins, Horatio Sanz, Nicole Richie","United States","October 25, 2018",2017,"TV-14","2 Seasons","TV Comedies","7+","7.0/10","66/100",1,0,0,0,"Medium",7,0.25,0.68
"TV Show","Here to Heart","","Janine Chun-Ning Chang, Hans Zhang","China","October 23, 2018",2018,"TV-14","1 Season","International TV Shows, Romantic TV Shows, TV Dramas","7+","7.4/10","39/100",1,0,0,0,"Medium",6,0.25,0.565
"TV Show","The Hollywood Masters","","","United States","October 23, 2018",2017,"TV-MA","3 Seasons","Stand-Up Comedy & Talk Shows","","7.3/10","44/100",1,0,0,0,"High",7,0.25,0.585
"TV Show","Ask the Doctor","","Shalin Naik, Renee Lim, Sandro Demaio","Australia","October 19, 2018",2017,"TV-PG","1 Season","Docuseries, International TV Shows, Science & Nature TV","","6.6/10","39/100",1,0,0,0,"Low",7,0.25,0.525
"TV Show","Best.Worst.Weekend.Ever.","","Sam Ashe Arnold, Cole Sand, Brianna Reed, Brittany Garms, Alison Becker, Larry Bates, Tiffany Espensen, Rachel Gage, Matt Battaglia, Affion Crockett","United States","October 19, 2018",2018,"TV-PG","1 Season","Kids' TV, TV Comedies","7+","6.4/10","38/100",1,0,0,0,"Low",6,0.25,0.51
"TV Show","Making a Murderer","","","United States","October 19, 2018",2018,"TV-14","2 Seasons","Crime TV Shows, Docuseries","16+","8.6/10","84/100",1,0,0,0,"Medium",6,0.25,0.85
"TV Show","Marvel's Daredevil","","Charlie Cox, Deborah Ann Woll, Elden Henson, Rosario Dawson, Vincent D'Onofrio, Jon Bernthal, Elodie Yung, Scott Glenn, Stephen Rider, Vondie Curtis-Hall, Ayelet Zurer, Toby Leonard Moore, Bob Gunton","United States","October 19, 2018",2018,"TV-MA","3 Seasons","Crime TV Shows, TV Action & Adventure","18+","8.6/10","90/100",1,0,0,0,"High",6,0.25,0.88
"TV Show","Project S The Series","","Wiwattanawarang Oabnithi, Mahayotaruk Thiti, Lerkcharoempoj Papangkorn, Imanothai Kawin, Sakuljaroensuk Apinya, Oat Pasakorn Sanrattana, Leeratanakajorn Thanapob, Skye Nateeton Wongrawee, Supapunpinyo Teeradon, Chansangavej Chayanit, Ketprapakorn Narikun, Pibunsonggram Kritsanapoom, Santinatornkul Chanon","Thailand","October 19, 2018",2017,"TV-MA","4 Seasons","International TV Shows, TV Dramas, Teen TV Shows","","","34/100",1,0,0,0,"High",7,0.25,NA
"TV Show","Wanderlust","","Toni Collette, Steven Mackintosh, Zawe Ashton, Joe Hurst, Emma D'Arcy, Celeste Dring, William Ash, Royce Pierreson, Jeremy Swift, Anastasia Hille, Isis Hainsworth, Sophie Okonedo","United Kingdom","October 19, 2018",2018,"TV-MA","1 Season","British TV Shows, International TV Shows, Romantic TV Shows","16+","7.1/10","60/100",1,0,0,0,"High",6,0.25,0.655
"TV Show","My Babysitter's a Vampire","","Matthew Knight, Vanessa Morgan, Atticus Mitchell, Cameron Kennedy, Kate Todd, Ari Cohen","Canada","October 17, 2018",2012,"TV-PG","2 Seasons","Kids' TV, TV Comedies","7+","7.1/10","58/100",1,0,0,0,"Low",12,0.25,0.645
"TV Show","Rake","","Richard Roxburgh, Matt Day, Adrienne Pickering, Russell Dykstra, Danielle Cormack, Caroline Brazier, Geoff Morrell, Kate Box, Keegan Joyce, Damien Garvey","Australia","October 16, 2018",2018,"TV-MA","5 Seasons","Crime TV Shows, International TV Shows, TV Comedies","16+","8.5/10","69/100",1,1,1,0,"High",6,0.75,0.77
"TV Show","Stunt Science","","","United Kingdom","October 15, 2018",2018,"TV-MA","1 Season","British TV Shows, International TV Shows, Reality TV","18+","5.0/10","30/100",1,0,0,0,"High",6,0.25,0.4
"TV Show","Edgar Rice Burroughs' Tarzan and Jane","","Marci T. House, Michael Dobson, Omari Newton, Paul Dobson, Rebecca Shoichet, Giles Panton, Kathleen Barr, Doron Bell","","October 12, 2018",2018,"TV-Y7","2 Seasons","Crime TV Shows, Kids' TV","7+","4.8/10","39/100",1,0,0,0,"Low",6,0.25,0.435
"TV Show","FIGHTWORLD","Padraic McKinley","Frank Grillo","","October 12, 2018",2018,"TV-MA","1 Season","Docuseries","18+","7.6/10","49/100",1,0,0,0,"High",6,0.25,0.625
"TV Show","The Curious Creations of Christine McConnell","","Christine McConnell, Colleen Smith, Adam Mayfield, Michael Oosterom, Drew Massey, Mick Ignis, Tim Lagasse, Dita von Teese, Steven M. Porter, Elko Weaver","United States","October 12, 2018",2018,"TV-PG","1 Season","TV Comedies, TV Mysteries","7+","7.8/10","62/100",1,0,0,0,"Low",6,0.25,0.7
"TV Show","The Haunting of Hill House","","Michiel Huisman, Carla Gugino, Timothy Hutton, Henry Thomas, Elizabeth Reaser, Oliver Jackson-Cohen, Kate Siegel, Victoria Pedretti, Lulu Wilson, Mckenna Grace, Paxton Singleton, Julian Hilliard, Violet McGraw","United States","October 12, 2018",2018,"TV-MA","1 Season","TV Dramas, TV Horror, TV Mysteries","18+","8.6/10","82/100",1,0,0,0,"High",6,0.25,0.84
"TV Show","Ordinary Heroes","","Giorgio Tirabassi, Marco Bocci, Cristiana Capotondi, Greta Scarano, Michela Cescon, Diane Fleri, Carlo Calderone, Claudio Gioè, Romina Mondello, Orlando Cinque, Luigi Maria Burruano, Riccardo Scamarcio, Lorenza Indovina, Ivana Lotito, Pierfrancesco Poggi, Marco Leonardi, Anna Ferruzzo, Peppino Mazzotta, Giorgio Marchesi","","October 11, 2018",2018,"TV-MA","1 Season","Crime TV Shows, International TV Shows, TV Dramas","","","13/100",1,0,0,0,"High",6,0.25,NA
"TV Show","Salt Fat Acid Heat","","Samin Nosrat","","October 11, 2018",2018,"TV-PG","1 Season","Docuseries","","7.7/10","60/100",1,0,0,0,"Low",6,0.25,0.685
"TV Show","Sofia the First","","Ariel Winter, Darcy Rose Byrnes, Sara Ramirez, Tim Gunn, Coco Grayson, Travis Willingham, Wayne Brady, Jess Harnell, Meghan Strange, Zach Callison","United States","October 8, 2018",2017,"TV-Y","4 Seasons","Kids' TV","all","6.9/10","57/100",1,0,0,0,"Low",7,0.25,0.63
"TV Show","Dancing Queen","","Justin ""Alyssa Edwards"" Johnson","","October 5, 2018",2018,"TV-14","1 Season","Reality TV","7+","7.0/10","49/100",1,0,0,0,"Medium",6,0.25,0.595
"TV Show","Empire Games","","Jim O'Brien","Czech Republic, United States","October 5, 2018",2018,"TV-14","1 Season","Docuseries","7+","5.7/10","38/100",1,0,0,0,"Medium",6,0.25,0.475
"TV Show","YG Future Strategy Office","","Seungri, Yoo Byung Jae, Lee Jai-jin, Jinu, Son Se-bin, Kim Ga-eun, Park Choong-hwan, Baek Yeong-gwang, Choi Sin-deuk","South Korea","October 5, 2018",2018,"TV-MA","1 Season","International TV Shows, Korean TV Shows, TV Comedies","18+","7.0/10","35/100",1,0,0,0,"High",6,0.25,0.525
"TV Show","Monty Python's Fliegender Zirkus","","Graham Chapman, John Cleese, Eric Idle, Terry Jones, Michael Palin, Connie Booth","United Kingdom, West Germany","October 2, 2018",1972,"TV-MA","1 Season","International TV Shows, TV Comedies","","8.2/10","48/100",1,0,0,0,"High",52,0.25,0.65
"TV Show","Monty Python's Flying Circus","","John Cleese, Graham Chapman, Terry Jones, Eric Idle, Michael Palin, Terry Gilliam","United Kingdom","October 2, 2018",1974,"TV-14","4 Seasons","British TV Shows, Classic & Cult TV, International TV Shows","16+","8.8/10","81/100",1,0,0,0,"Medium",50,0.25,0.845
"TV Show","Monty Python's Personal Best","","John Cleese, Terry Gilliam, Terry Jones, Graham Chapman, Michael Palin, Eric Idle","United States, United Kingdom","October 2, 2018",2005,"TV-MA","1 Season","British TV Shows, TV Comedies","16+","7.9/10","46/100",1,0,0,0,"High",19,0.25,0.625
"TV Show","Hot Date","","Emily Axford, Brian Murphy","United States","October 1, 2018",2018,"TV-MA","1 Season","Romantic TV Shows, TV Comedies","16+","7.1/10","48/100",1,0,1,0,"High",6,0.5,0.595
"TV Show","Strong","","Gabrielle Reece","United States","October 1, 2018",2016,"TV-14","1 Season","Reality TV","7+","7.5/10","39/100",1,0,0,0,"Medium",8,0.25,0.57
"TV Show","Made in Mexico","","","United States","September 28, 2018",2018,"TV-MA","1 Season","International TV Shows, Reality TV, Spanish-Language TV Shows","","4.1/10","32/100",1,0,0,0,"High",6,0.25,0.365
"TV Show","Skylanders Academy","","Justin Long, Ashley Tisdale, Jonathan Banks, Chris Diamantopoulos, Bobcat Goldthwait, Richard Steven Horvitz, Norm MacDonald, Daniel Middleton, Catherine O'Hara, Parker Posey, Jonny Rees, Jason Ritter, Susan Sarandon, Harland Williams, Daniel Wu, Dee Bradley Baker, Chris Cox, Jim Cummings, Felicia Day, John DiMaggio, Grey Griffin","South Korea, United States","September 28, 2018",2018,"TV-Y7","3 Seasons","Kids' TV, TV Comedies","7+","6.6/10","45/100",1,0,0,0,"Low",6,0.25,0.555
"TV Show","Battlefish","","","","September 21, 2018",2018,"TV-MA","1 Season","Reality TV, Science & Nature TV, TV Action & Adventure","","7.1/10","43/100",1,0,0,0,"High",6,0.25,0.57
"TV Show","Maniac","","Emma Stone, Jonah Hill, Justin Theroux, Sally Field, Gabriel Byrne, Sonoya Mizuno, Julia Garner, Billy Magnussen, Jemima Kirke","United States","September 21, 2018",2018,"TV-MA","1 Season","TV Comedies, TV Dramas, TV Mysteries","18+","7.8/10","78/100",1,0,0,0,"High",6,0.25,0.78
"TV Show","The Good Cop","","Tony Danza, Josh Groban, Monica Barbaro, Isiah Whitlock Jr.","United States","September 21, 2018",2018,"TV-14","1 Season","Crime TV Shows, TV Comedies, TV Dramas","16+","7.1/10","58/100",1,0,0,0,"Medium",6,0.25,0.645
"TV Show","Transformers: Rescue Bots","","Lacey Chabert, Elan Garfias, Maurice LaMarche, Jason Marsden, Shannon McKain, Steve Blum, Parvesh Cheena, D.C. Douglas, Imari Williams, LeVar Burton, Diamond White","Canada, United States","September 19, 2018",2016,"TV-Y7","1 Season","Kids' TV","7+","6.5/10","50/100",1,0,1,0,"Low",8,0.5,0.575
"TV Show","Al Hayba","","Taim Hasan, Nadine Nassib Njeim, Abdo Chahine, Oweiss Mkhallalati, Mona Wassef","Lebanon","September 15, 2018",2017,"TV-14","1 Season","Crime TV Shows, International TV Shows, TV Dramas","7+","7.4/10","55/100",1,0,0,0,"Medium",7,0.25,0.645
"TV Show","American Vandal","","Tyler Alvarez, Griffin Gluck, Jimmy Tatro, Camille Hyde, Lou Wilson, Eduardo Franco, Jessica Juarez, Camille Ramsey, Calum Worthy, G. Hannelius, Karly Rothenberg","United States","September 14, 2018",2018,"TV-MA","2 Seasons","Crime TV Shows, TV Comedies, Teen TV Shows","16+","8.2/10","78/100",1,0,0,0,"High",6,0.25,0.8
"TV Show","Boca Juniors Confidential","","","","September 14, 2018",2018,"TV-PG","1 Season","Docuseries, International TV Shows, Spanish-Language TV Shows","all","6.4/10","38/100",1,0,0,0,"Low",6,0.25,0.51
"TV Show","Norm Macdonald Has a Show","","","United States","September 14, 2018",2018,"TV-MA","1 Season","Stand-Up Comedy & Talk Shows, TV Comedies","","8.7/10","61/100",1,0,0,0,"High",6,0.25,0.74
"TV Show","The Rise of Phoenixes","","Chen Kun, Ni Ni, Zhao Lixin, Ni Dahong, Yuan Hong, Wang Ou, Bai Jinting, Zhang Xiaochen, Mei Ting, Liu Mintao, Yu Mingjia, Hou Yansong, Hai Yitian, Shi An, Shao Tong","China","September 14, 2018",2018,"TV-14","1 Season","International TV Shows, Romantic TV Shows, TV Action & Adventure","7+","8.6/10","56/100",1,0,0,0,"Medium",6,0.25,0.71
"TV Show","Life","","Lee Dong-wook, Cho Seung-woo, Won Jin-ah, Lee Kyu-hyung, Moon Sung-keun, Yoo Jae-myung, Moon So-ri, Chun Ho-jin","South Korea","September 12, 2018",2018,"TV-MA","1 Season","International TV Shows, Korean TV Shows, TV Dramas","","7.6/10","46/100",1,0,0,0,"High",6,0.25,0.61
"TV Show","Daniel Sloss: Live Shows","","Daniel Sloss","United States","September 11, 2018",2018,"TV-MA","1 Season","Stand-Up Comedy & Talk Shows, TV Comedies","18+","8.6/10","55/100",1,0,0,0,"High",6,0.25,0.705
"TV Show","Show Me the Money","","Afdlin Shauki, Patrick Teoh, Mano Maniam, Rashid Salleh, Soefira Jaafar, Nell Ng, Juliana Ibrahim, Wandy She","","September 9, 2018",2004,"TV-14","2 Seasons","International TV Shows, TV Comedies","","","16/100",1,0,0,0,"Medium",20,0.25,NA
"TV Show","First and Last","","","","September 7, 2018",2018,"TV-MA","1 Season","Docuseries","18+","6.7/10","44/100",1,0,0,0,"High",6,0.25,0.555
"TV Show","Marvel's Iron Fist","","Finn Jones, Jessica Henwick, David Wenham, Jessica Stroup, Tom Pelphrey","United States","September 7, 2018",2018,"TV-MA","2 Seasons","Crime TV Shows, TV Action & Adventure, TV Dramas","18+","6.5/10","73/100",1,0,0,0,"High",6,0.25,0.69
"TV Show","Stretch Armstrong & the Flex Fighters","","Scott Menville, Steven Yeun, Ogie Banks, Wil Wheaton, Keith David, Miguel Ferrer, David Kaye, Kate Mulgrew, Nazneen Contractor, Felicia Day","United States","September 7, 2018",2018,"TV-Y7","2 Seasons","Kids' TV","7+","6.5/10","42/100",1,0,0,0,"Low",6,0.25,0.535
"TV Show","Monkey Twins","","Phakin Khamwilaisak, Sumret Muengput, Alisa Kunkwaeng, Zozeen Panyanut Jirarottanakasem, Akarat Nimitchai, Warawut Poyim, Vithaya Pansringarm, Phutharit Prombandal, Kazu Patrick Tang","Thailand","September 2, 2018",2018,"TV-MA","1 Season","Crime TV Shows, International TV Shows, TV Action & Adventure","","7.9/10","35/100",1,0,0,0,"High",6,0.25,0.57
"TV Show","Quantico","","Priyanka Chopra, Josh Hopkins, Jake McLaughlin, Aunjanue Ellis, Yasmine Al Massri, Johanna Braddy, Tate Ellington, Graham Rogers, Anabelle Acosta, Russell Tovey, Blair Underwood, Pearl Thusi","United States","September 2, 2018",2018,"TV-14","3 Seasons","Crime TV Shows, TV Dramas, TV Mysteries","16+","6.7/10","73/100",1,0,0,0,"Medium",6,0.25,0.7
"TV Show","Age of Rebellion","Peter Ho","Peter Ho, Jeanine Yang, Tammy Chen, Jason Tsou, Chang Ting-hu, Nana Lee, Nien Hsuan Wu","Taiwan","September 1, 2018",2018,"TV-MA","1 Season","Crime TV Shows, International TV Shows, TV Dramas","","8.6/10","41/100",1,0,0,0,"High",6,0.25,0.635
"TV Show","Sisters","","Lucy Durack, Antonia Prebble, Maria Angelico, Dan Spielman, Charlie Garber, Lindsay Farris, Zindzi Okenyo, Catherine McClements, Roy Billing, Magda Szubanski","Australia","September 1, 2018",2018,"TV-MA","1 Season","International TV Shows, TV Comedies, TV Dramas","","7.5/10","52/100",1,0,0,0,"High",6,0.25,0.635
"TV Show","Cathedral of the Sea","","Daniel Grao, Ginés García Millán, Óscar Hernández, Alain Hernández, Nora Navas, Lucía Díez, Jorge Kent, Ali El Aziz, Julia Carnero, David Venancio Muro, Jonás Beramí, Hugo Arbues, Natalia de Molina","Spain","August 31, 2018",2017,"TV-MA","1 Season","International TV Shows, Spanish-Language TV Shows, TV Dramas","16+","7.5/10","56/100",1,0,0,0,"High",7,0.25,0.655
"TV Show","Inside the Criminal Mind","","","United States, Czech Republic","August 31, 2018",2018,"TV-MA","1 Season","Crime TV Shows, Docuseries, International TV Shows","18+","5.5/10","45/100",1,1,0,0,"High",6,0.5,0.5
"TV Show","The Comedy Lineup","","Michelle Buteau, Ian Karmel, Taylor Tomlinson, Sam Jay, Phil Wang, Sabrina Jalees, Jak Knight, Tim Dillon","United States","August 31, 2018",2018,"TV-MA","2 Seasons","Stand-Up Comedy & Talk Shows, TV Comedies","18+","5.9/10","40/100",1,0,0,0,"High",6,0.25,0.495
"TV Show","Ultimate Beastmaster","","Tiki Barber, Chris Distefano, Francesco Facchinetti, Bianca Balti, Vidyut Jammwal, Sarah-Jane Dias, BIn Gu, Qinyi Du, Paula Vázquez, Saúl Craviotto, Gilles Marini, Sandy Heribert, Terry Crews, Charissa Thompson, Yuji Kondo, Sayaka Akimoto, Luke Mockridge, Hans Sarpei, Kyung-seok Seo, Kyeong-rim Park, Luis Ernesto Franco, Inés Sainz, Rafinha Bastos, Anderson Silva, Sylvester Stallone","United States, Brazil, South Korea, Mexico, Japan, Germany","August 31, 2018",2018,"TV-PG","3 Seasons","Reality TV","all","7.3/10","53/100",1,0,0,0,"Low",6,0.25,0.63
"TV Show","GHOUL","Patrick Graham","Radhika Apte, Manav Kaul, Ratnabali Bhattacharjee, Mahesh Balraj","India","August 24, 2018",2018,"TV-MA","1 Season","International TV Shows, TV Dramas, TV Horror","18+","7.1/10","69/100",1,0,0,0,"High",6,0.25,0.7
"TV Show","Take My Brother Away","Han Qing","Sun Qian, Joseph Zeng, Lv Xiao Yu, Hu Yong Tao, Wang Xu Dong, Ma Bai Quan","China","August 24, 2018",2018,"TV-14","1 Season","International TV Shows, TV Comedies, TV Dramas","all","7.1/10","43/100",1,0,0,0,"Medium",6,0.25,0.57
"TV Show","The Innocents","","Sorcha Groundsell, Percelle Ascott, Guy Pearce, Sam Hazeldine, Nadine Marshall, Jóhannes Haukur Jóhannesson, Laura Birn, Ingunn Beate Øyen, Arthur Hughes, Trond Fausa, Lise Risom Olsen, Philip Wright","United Kingdom","August 24, 2018",2018,"TV-MA","1 Season","British TV Shows, International TV Shows, Romantic TV Shows","","6.3/10","63/100",1,0,0,0,"High",6,0.25,0.63
"Movie","Mom","Ravi Udyawar","Sridevi, Akshaye Khanna, Sajal Ali, Nawazuddin Siddiqui, Adnan Siddiqui, Pitobash, Abhimanyu Singh, Vikas Verma","India","August 21, 2018",2017,"TV-14","139 min","Dramas, International Movies, Thrillers","16+","7.2/10","71/100",1,1,0,0,"Medium",7,0.5,0.715
"TV Show","Stay Here","","Genevieve Gorder, Peter Lorimer","United States","August 17, 2018",2018,"TV-PG","1 Season","Reality TV","7+","7.5/10","50/100",1,0,0,0,"Low",6,0.25,0.625
"TV Show","72 Dangerous Animals: Asia","","Bob Brisbane","Australia","August 10, 2018",2018,"TV-14","1 Season","Docuseries, International TV Shows, Science & Nature TV","16+","6.6/10","45/100",1,0,0,0,"Medium",6,0.25,0.555
"TV Show","Afflicted","","","United States","August 10, 2018",2018,"TV-MA","1 Season","Docuseries, Reality TV, Science & Nature TV","18+","5.0/10","46/100",1,0,1,0,"High",6,0.5,0.48
"TV Show","All About the Washingtons","","Joseph Simmons, Justine Simmons, Kiana Ledé, Nathan Anderson, Leah Rose Randall, Maceo Smedley, Quincy Fouse, DJ Ruckus, Adain Bradley, Tim Meadows, Daymond John, Erick Chavarria, Christopher Clarke, Aubrey Cleland, Arsenio Hall, Stephen Schneider, Max Goudsmit, Noah Gerry, Jamie VanDyke, Ashleigh Hairston","United States","August 10, 2018",2018,"TV-PG","1 Season","TV Comedies","all","4.5/10","45/100",1,0,0,0,"Low",6,0.25,0.45
"TV Show","The Originals","","Joseph Morgan, Daniel Gillies, Phoebe Tonkin, Charles Michael Davis, Leah Pipes, Danielle Campbell, Claire Holt, Steven Krueger","United States","August 9, 2018",2018,"TV-14","5 Seasons","TV Dramas, TV Horror, TV Mysteries","16+","8.2/10","80/100",1,0,0,0,"Medium",6,0.25,0.81
"TV Show","On Children","","Chuan-Chen Yeh, Chung Hsin-ling, Frances Wu, Chiung-Hsuan Hsieh, Su-Yun Ko, Ivy Yin, Gingle Wang, Hsiu-Fu Liu, Tzu-Chuan Liu, Yu-Xuan Wang","Taiwan","August 5, 2018",2018,"TV-14","1 Season","International TV Shows, TV Dramas, TV Mysteries","","7.5/10","43/100",1,0,0,0,"Medium",6,0.25,0.59
"TV Show","Cocaine Coast","","Javier Rey, Tristán Ulloa, Antonio Durán 'Morris', Carlos Blanco, Manuel Lourenzo, Jana Pérez, Xosé Antonio Touriñán, Isabel Naveira, Eva Fernández, Juan Pablo Shuk","Spain","August 3, 2018",2018,"TV-MA","1 Season","Crime TV Shows, International TV Shows, Spanish-Language TV Shows","18+","7.9/10","61/100",1,0,0,0,"High",6,0.25,0.7
"TV Show","Becoming Champions","","","Mexico","August 1, 2018",2018,"TV-G","1 Season","Docuseries, International TV Shows","all","6.7/10","40/100",1,0,0,0,"Low",6,0.25,0.535
"TV Show","Switched","","Daiki Shigeoka, Tomohiro Kamiyama, Kaya Kiyohara, Miu Tomita, Reika Kirishima, Shinji Rokkaku, Miu Suzuki, Riko Hisada, Megumi Seki, Shoko Nakajima","Japan","August 1, 2018",2018,"TV-MA","1 Season","International TV Shows, TV Dramas, TV Mysteries","16+","7.1/10","53/100",1,0,0,0,"High",6,0.25,0.62
