"Type","Title","Director","Cast","Country","Date_added","Release_year","Rating","Duration","Listed_in","Age","IMDb","Rotten.Tomatoes","Netflix","Hulu","Prime.Video","Disney","Rating_category","Age_years","Cross_platform_score","Overall_score"
"TV Show","Cells at Work!","","Kana Hanazawa, Tomoaki Maeno, Daisuke Ono, Kikuko Inoue, Maria Naganawa, Takahiro Sakurai, Saori Hayami, Nobuhiko Okamoto, Yuichi Nakamura, Shoya Chiba, M・A・O, Ayako Kawasumi, Aya Endo, Hiroyuki Yoshino, Mamiko Noto","Japan","January 1, 2020",2018,"TV-PG","1 Season","Anime Series, Teen TV Shows","16+","7.6/10","58/100",1,0,0,0,"Low",6,0.25,0.67
"Movie","Ghost Stories","Anurag Kashyap, Dibakar Banerjee, Karan Johar, Zoya Akhtar","Janhvi Kapoor, Sobhita Dhulipala, Sukant Goel, Gulshan Devaiah, Mrunal Thakur, Avinash Tiwary, Vijay Varma, Sagar Arya, Surekha Sikri, Pavail Gulati","India","January 1, 2020",2020,"TV-MA","145 min","Horror Movies, International Movies, Thrillers","","6.6/10","39/100",1,1,1,0,"High",4,0.75,0.525
"TV Show","Live Up To Your Name","","Kim Nam-gil, Kim Ah-joong, Yoo Min-kyu, Moon Ga-young, Yun Ju-sang, Um Hyo-sup, An Seok-hwan, Lee Dae-yeon, Oh Dae-whan","South Korea","January 1, 2020",2017,"TV-MA","1 Season","International TV Shows, Korean TV Shows, Romantic TV Shows","","7.9/10","48/100",1,0,0,0,"High",7,0.25,0.635
"TV Show","Messiah","","Michelle Monaghan, Mehdi Dehbi, John Ortiz, Tomer Sisley, Melinda Page Hamilton, Stefania LaVie Owen, Sayyid El Alami, Jane Adams, Wil Traval, Fares Landoulsi","United States","January 1, 2020",2020,"TV-MA","1 Season","TV Dramas, TV Thrillers","18+","7.6/10","70/100",1,0,0,0,"High",4,0.25,0.73
"TV Show","Mia and Me","","Rosabell Laurenti Sellers, Adrian Moore, Saphia Stoney, Josephine Benini, Andrew Craig, Tajja Isen, Rod Wilson, Linda Ballantyne, Jonathan Wilson, Elizabeth Hanna, Norma Dell'Agnese","Netherlands, Germany, Italy, Canada","January 1, 2020",2017,"TV-Y7","2 Seasons","Kids' TV","all","6.6/10","45/100",1,0,0,0,"Low",7,0.25,0.555
"TV Show","Reply 1988","","Lee Hye-ri, Park Bo-gum, Ryu Jun-yeol, Ko Kyoung-pyo, Lee Dong-hwi, Ryu Hye-young, Sung Dong-il, Lee Il-hwa","South Korea","January 1, 2020",2015,"TV-14","1 Season","International TV Shows, Korean TV Shows, Romantic TV Shows","","9.1/10","67/100",1,0,0,0,"Medium",9,0.25,0.79
"TV Show","Save Me","","Taecyeon, Seo Ye-ji, Cho Seong-ha, Woo Do‑hwan, Son Byung-ho, Kim Kwang-gyoo, Yun Yoo-sun, Park Ji-young, Jeong Hae-gyoon, Jang Hyeok-jin","South Korea","January 1, 2020",2017,"TV-MA","1 Season","International TV Shows, Korean TV Shows, TV Dramas","16+","7.7/10","64/100",1,0,0,0,"High",7,0.25,0.705
"TV Show","Spinning Out","","Kaya Scodelario, January Jones, Will Kemp, Willow Shields, Evan Roderick, David James Elliott, Sarah Wright Olsen, Svetlana Efremova, Amanda Zhou, Mitchell Edwards, Kaitlyn Leeb, Johnny Weir","United States","January 1, 2020",2020,"TV-MA","1 Season","TV Dramas","18+","7.6/10","67/100",1,0,0,0,"High",4,0.25,0.715
"TV Show","ARASHI's Diary -Voyage-","","Arashi","Japan","December 31, 2019",2019,"TV-PG","1 Season","Docuseries, International TV Shows","","7.4/10","32/100",1,0,0,0,"Low",5,0.25,0.53
"TV Show","Occupied","","Henrik Mestad, Ane Dahl Torp, Ingeborga Dapkunaite, Eldar Skar, Ragnhild Gudbrandsen, Kristin Braut-Solheim","Norway, Sweden","December 31, 2019",2019,"TV-MA","3 Seasons","International TV Shows, TV Dramas, TV Thrillers","16+","7.7/10","62/100",1,0,0,0,"High",5,0.25,0.695
"TV Show","Rainbow Ruby","","Alyssya Swales, Shannon Chan-Kent, Brian Drummond, Olivia Charles, Kate Higgins, Johnny Yong Bosch","South Korea, Canada, United States, China","December 31, 2019",2016,"TV-Y","1 Season","Kids' TV","all","6.6/10","39/100",1,0,0,0,"Low",8,0.25,0.525
"TV Show","Robot Trains","","Bill Rogers, Carrie Savage, Ken Spassione, Angela Mulligan, Mark Szabo, Daniel J. Edwards, Mike Pollock, Anthony Salerno","South Korea","December 31, 2019",2018,"TV-Y7","2 Seasons","Kids' TV, Korean TV Shows","all","6.2/10","40/100",1,0,1,0,"Low",6,0.5,0.51
"TV Show","The Degenerates","","Big Jay Oakerson, Brad Williams, Yamaneika Saunders, Liza  Treyger, Joey Diaz, Christina Pazsitzky","","December 31, 2019",2019,"TV-MA","2 Seasons","Stand-Up Comedy & Talk Shows, TV Comedies","18+","6.2/10","36/100",1,0,0,0,"High",5,0.25,0.49
"TV Show","Yanxi Palace: Princess Adventures","","Wang Herun, Wang Yizhe, Wang Yuwei, Xu Xiaonuo, Wu Jinyan, Nie Yuan","China","December 31, 2019",2019,"TV-14","1 Season","International TV Shows, TV Dramas","","5.8/10","38/100",1,0,0,0,"Medium",5,0.25,0.48
"TV Show","The Disastrous Life of Saiki K.: Reawakened","","Hiroshi Kamiya, Daisuke Ono, Nobunaga Shimazaki, Satoshi Hino, Natsuki Hanae, Ai Kayano, Yukari Tamura, Maaya Uchida, Yoshimasa Hosoya, Masaya Matsukaze, Tomoaki Maeno, Kenji Nojima, Mitsuo Iwata, Rikako Aikawa, Yuki Kaji, Eri Kitamura, M・A・O, Kensho Ono, Kohsuke Toriumi, Nao Toyama","Japan","December 30, 2019",2019,"TV-14","1 Season","Anime Series, International TV Shows","","7.9/10","51/100",1,0,0,0,"Medium",5,0.25,0.65
"TV Show","The Bonfire of Destiny","","Audrey Fleurot, Julie de Bona, Camille Lou, Gilbert Melki, Josiane Balasko, Antoine Duléry, Florence Pernel, Théo Fernandez, Victor Meutelet, François-David Cardonnel, Stéphane Guillon, Aurélien Wiik, Gilles Cohen","France","December 26, 2019",2019,"TV-MA","1 Season","International TV Shows, TV Dramas","16+","7.7/10","55/100",1,0,0,0,"High",5,0.25,0.66
"TV Show","Lost in Space","","Molly Parker, Toby Stephens, Max Jenkins, Taylor Russell, Mina Sundwall, Parker Posey, Ignacio Serricchio","United States","December 24, 2019",2019,"TV-PG","2 Seasons","TV Action & Adventure, TV Dramas, TV Sci-Fi & Fantasy","7+","7.3/10","80/100",1,1,0,0,"Low",5,0.5,0.765
"TV Show","Private Practice","","Kate Walsh, Tim Daly, Audra McDonald, Paul Adelstein, Taye Diggs, Amy Brenneman, KaDee Strickland, Chris Lowell, Brian Benben","United States","December 22, 2019",2012,"TV-14","6 Seasons","TV Comedies, TV Dramas","16+","6.7/10","69/100",1,1,0,0,"Medium",12,0.5,0.68
"TV Show","Agent","","Khumbulani Kay Sibiya, Sisanda Henna, Tarynn Wyngaard, Anthony Oseyemi, Virgile Bramly, Manie Malone, Yannick Konnan, Vinaya Sungkur, Michaella Russell, Thabo Malema","Mauritius, South Africa","December 20, 2019",2019,"TV-MA","1 Season","International TV Shows, TV Dramas","","7.2/10","42/100",1,0,0,0,"High",5,0.25,0.57
"TV Show","The Witcher","","Henry Cavill, Anya Chalotra, Freya Allan, Jodhi May, MyAnna Buring, Joey Batey, Eamon Farren, Mimi Ndiweni, Björn Hlynur Haraldsson, Adam Levy, Lars Mikkelsen, Royce Pierreson, Wilson Radjou-Pujalte, Anna Shaffer","United States, Poland","December 20, 2019",2019,"TV-MA","1 Season","International TV Shows, TV Action & Adventure, TV Dramas","18+","8.2/10","89/100",1,0,0,0,"High",5,0.25,0.855
"TV Show","Ultraviolet","","Marta Nieradkiewicz, Sebastian Fabijański, Agata Kulesza, Bartłomiej Topa, Magdalena Czerwińska, Michał Żurawski, Marek Kalita, Paulina Chapko, Karolina Chapko, Viet Anh Do","Poland","December 19, 2019",2019,"TV-MA","2 Seasons","Crime TV Shows, International TV Shows, TV Dramas","18+","7.0/10","55/100",1,1,0,0,"High",5,0.5,0.625
"TV Show","Don't F**k with Cats: Hunting an Internet Killer","Mark Lewis","","United Kingdom, United States","December 18, 2019",2019,"TV-MA","1 Season","Crime TV Shows, Docuseries","18+","8.0/10","74/100",1,0,0,0,"High",5,0.25,0.77
"TV Show","Soundtrack","","Paul James, Callie Hernandez, Marianne Jean-Baptiste, Jenna Dewan, Jahmil French, Megan Ferguson, Madeleine Stowe, Campbell Scott, Isaiah Givens","United States","December 18, 2019",2019,"TV-MA","1 Season","Romantic TV Shows, TV Dramas","","6.8/10","52/100",1,0,0,0,"High",5,0.25,0.6
"TV Show","Cocomong","","Jung Sun-hye, Yang Jeong-hwa, Kim Jang, Ryoo Jeom-hee, Hong Bum-ki, Shin Yong-woo","United States","December 15, 2019",2015,"TV-Y","2 Seasons","Kids' TV, Korean TV Shows","","4.3/10","29/100",1,0,0,0,"Low",9,0.25,0.36
"TV Show","Crash Landing on You","","Hyun Bin, Son Ye-jin, Seo Ji-hye, Kim Jung-hyun, Oh Man-seok, Kim Young-min, Kim Jung-nan, Kim Sun-young, Hwangwoo Seul-hye","South Korea","December 15, 2019",2019,"TV-14","1 Season","International TV Shows, Korean TV Shows, Romantic TV Shows","16+","8.7/10","71/100",1,0,0,0,"Medium",5,0.25,0.79
"TV Show","Crazy, Lovely, Cool","Obi Emelonye","Enyinna Nwigwe, Adesua Etomi, Uru Eke, Zynnell Zuh, Obi Okolie, Anthony Monjaro, Emmanuel Emelu, Chinonye Chidolue, Lorenzo Menakaya, King Bawa","Nigeria","December 15, 2019",2018,"TV-MA","1 Season","International TV Shows, TV Dramas","","7.8/10","33/100",1,0,0,0,"High",6,0.25,0.555
"TV Show","Girls und Panzer","Tsutomu Mizushima","Mai Fuchigami, Ai Kayano, Mami Ozaki, Ikumi Nakagami, Yuka Iguchi, Misato Fukuen, Mikako Takahashi, Kana Ueda","Japan","December 15, 2019",2012,"TV-PG","1 Season","Anime Series, International TV Shows","16+","7.4/10","52/100",1,1,0,0,"Low",12,0.5,0.63
"TV Show","Astronomy Club: The Sketch Show","","Shawtane Bowen, Jonathan Braylock, Ray Cordova, Caroline Martin, Jerah Milligan, Monique Moses, Keisha Zollar, James III","United States","December 6, 2019",2019,"TV-MA","1 Season","TV Comedies","18+","7.1/10","45/100",1,0,0,0,"High",5,0.25,0.58
"TV Show","Fuller House","","Candace Cameron Bure, Jodie Sweetin, Andrea Barber, Michael Campion, Elias Harger, Soni Bringas, Dashiell Messitt, Fox Messitt, John Stamos, Bob Saget, Dave Coulier, Lori Loughlin, Scott Weinger, Blake Tuomy-Wilhoit, Dylan Tuomy-Wilhoit, John Brotherton, Juan Pablo Di Pace","United States","December 6, 2019",2020,"TV-PG","5 Seasons","TV Comedies","7+","6.7/10","67/100",1,0,0,0,"Low",4,0.25,0.67
"TV Show","Teasing Master Takagi-san","","Rie Takahashi, Yuki Kaji, Konomi Kohara, M・A・O, Yui Ogura, Yuma Uchida, Kotori Koiwai, Nobuhiko Okamoto, Fukushi Ochiai","Japan","December 6, 2019",2019,"TV-PG","1 Season","Anime Series, International TV Shows, Romantic TV Shows","7+","7.7/10","60/100",1,0,0,0,"Low",5,0.25,0.685
"TV Show","The Chosen One","Michel Tikhomiroff","Paloma Bernardi, Renan Tenca, Gutto Szuster, Pedro Caetano, Mariano Mattos Martins, Alli Willow, Kiko Vianello, Francisco Gaspar, Tuna Dwek, Lourinelson Vladmir, Leonardo Ventura, Aury Porto, Glauber Amaral, Astrea Lucena","Brazil","December 6, 2019",2019,"TV-MA","2 Seasons","International TV Shows, TV Dramas, TV Mysteries","18+","5.8/10","47/100",1,0,0,0,"High",5,0.25,0.525
"TV Show","The Confession Killer","Robert Kenner, Taki Oldham","","United States","December 6, 2019",2019,"TV-14","1 Season","Crime TV Shows, Docuseries","16+","7.4/10","68/100",1,0,0,0,"Medium",5,0.25,0.71
"TV Show","Three Days of Christmas","","Victoria Abril, Elena Anaya, Mar Ayala, Nerea Barros, Berta Castañé, Verónica Echegui, Verónica Forqué, Ángela Molina, Anna Moliner, Charo López, Mariona Pagès, Carla Tous, Carles Arquimbau, Manel Barceló, Nausicaa Bonnín, Alicia Borrachero, Antonio Dechent, Miquel Fernández, Francesc Garrido, Iván Morales, Susi Sánchez, David Solans","Spain","December 6, 2019",2019,"TV-MA","1 Season","International TV Shows, Spanish-Language TV Shows, TV Dramas","18+","6.8/10","44/100",1,0,0,0,"High",5,0.25,0.56
"TV Show","Triad Princess","","Eugenie Liu, Jasper Liu, Cecilia Choi, Tien Hsin, Michael JQ Huang, Chang Zhang-xing, Hung Yan-siang, Tsao Yu-ning, Chang Shu-wei, Lee Lee-zen","","December 6, 2019",2019,"TV-MA","1 Season","Crime TV Shows, International TV Shows, Romantic TV Shows","18+","6.9/10","43/100",1,0,0,0,"High",5,0.25,0.56
"TV Show","V Wars","","Ian Somerhalder, Adrian Holmes, Jacky Lai, Kyle Breitkopf, Peter Outerbridge, Kimberly-Sue Murray, Sydney Meyer, Kandyse McClure, Laura Vandervoort, Michael Greyeyes, Greg Bryk, Teddy Moynihan, Ted Atherton, Jonathan Higgins, Nikki Reed, Samantha Liana Cole, Laura de Carteret, Bo Martyn","United States","December 5, 2019",2019,"TV-MA","1 Season","TV Action & Adventure, TV Dramas, TV Horror","18+","6.1/10","60/100",1,0,0,0,"High",5,0.25,0.605
"TV Show","The Last O.G.","","Tracy Morgan, Tiffany Haddish, Cedric the Entertainer, Allen Maldonado, Ryan Gaul, Taylor Mosby, Dante Hoagland, Joel Marsh Garland, Gino Vento, Derek Gaines, Daniel J. Watts, Malik Yoba, Edi Patterson","United States","December 4, 2019",2019,"TV-MA","2 Seasons","TV Comedies","7+","6.9/10","55/100",1,0,0,0,"High",5,0.25,0.62
"TV Show","Nightflyers","","Eoin Macken, David Ajala, Jodie Turner-Smith, Angus Sampson, Sam Strike, Maya Eshet, Brían F. O'Byrne, Gretchen Mol, Miranda Raison","United States","December 2, 2019",2018,"TV-MA","1 Season","TV Horror, TV Mysteries, TV Sci-Fi & Fantasy","18+","5.9/10","61/100",1,0,0,0,"High",6,0.25,0.6
"TV Show","Space Jungle","","Kim Min-hee, Park Yoon-hee, Sun Sung-wook","","December 1, 2019",2016,"TV-Y","2 Seasons","Kids' TV, Korean TV Shows, TV Comedies","all","","39/100",1,0,0,0,"Low",8,0.25,NA
"TV Show","Chocolate","","Ha Ji-won, Yoon Kye-sang, Jang Seung-jo, Kang Bu-ja, Lee Jae-ryong, Min Jin-woong, Kim Won-hae, Yoo Teo","South Korea","November 30, 2019",2019,"TV-14","1 Season","International TV Shows, Korean TV Shows, Romantic TV Shows","","7.7/10","49/100",1,0,0,0,"Medium",5,0.25,0.63
"TV Show","Chip and Potato","","Abigail Oliver, Andrea Libman, Briana Buckmaster, Brian Dobson, Chance Hurstfield, Dominic Good, Emma Jayne Maas, Evan Byarushengo, Scotia Anderson, Alessandro Juliani","United Kingdom, Canada","November 29, 2019",2019,"TV-Y","2 Seasons","Kids' TV","all","6.2/10","36/100",1,0,0,0,"Low",5,0.25,0.49
"TV Show","La Reina del Sur","","Kate del Castillo, Cristina Urgel, Alberto Jiménez, Juan José Arjona, Humberto Zurita, Dagoberto Gama, Christian Tappán, Miguel de Miguel, Salvador Zerboni, Carmen Navarro, Santiago Meléndez, Juan Carlos Solarte","Mexico, United States, Spain, Colombia","November 29, 2019",2019,"TV-MA","2 Seasons","Crime TV Shows, International TV Shows, Spanish-Language TV Shows","18+","8.0/10","62/100",1,0,0,0,"High",5,0.25,0.71
"TV Show","The Charming Stepmom","","Shahkrit Yamnarm, View Wannarot Sontichai, Krittanai Arsalprakit, Ployshompoo Supasap, Boriboon Chanrueng, Shawankorn Wanthanapisitkul, Duangta Toongkamanee, Daraneenuch Pasutanavin, Phuwin Tangsakyuen, Nuntasai Pisolyabut, Pimmara Charoenpakdee, Thanawat Rattanakitpaisan","","November 29, 2019",2019,"TV-14","1 Season","International TV Shows, Romantic TV Shows, TV Comedies","","","37/100",1,0,0,0,"Medium",5,0.25,NA
"TV Show","Levius","","Nobunaga Shimazaki, Junichi Suwabe, Takahiro Sakurai, Ayane Sakura, Hochu Otsuka, Daisuke Ono, Saori Hayami, Mamoru Miyano","Japan","November 28, 2019",2019,"TV-14","1 Season","Anime Series, International TV Shows","","7.0/10","50/100",1,0,0,0,"Medium",5,0.25,0.6
"TV Show","Lugar de Mulher","","","Brazil","November 28, 2019",2019,"TV-MA","1 Season","International TV Shows, Stand-Up Comedy & Talk Shows, TV Comedies","","4.5/10","26/100",1,0,0,0,"High",5,0.25,0.355
"TV Show","Merry Happy Whatever","","Dennis Quaid, Bridgit Mendler, Brent Morin, Ashley Tisdale, Siobhan Murphy, Adam Rose, Elizabeth Ho, Hayes MacArthur, Garcelle Beauvais, Tyler Ritter, Mason Davis, Lucas Jaye","United States","November 28, 2019",2019,"TV-PG","1 Season","TV Comedies","","6.3/10","51/100",1,0,0,0,"Low",5,0.25,0.57
"TV Show","The Crime","","Magdalena Boczarska, Wojciech Zieliński, Joanna Kulig, Radosław Pazura, Magdalena Zawadzka, Dorota Kolak, Zdzislaw Wardejn, Małgorzata Rożniatowska, Aleksandra Popławska, Lukasz Nowicki, Tamara Arciuch, Rafał Cieszyński, Karolina Kominek","Poland","November 26, 2019",2015,"TV-MA","2 Seasons","Crime TV Shows, International TV Shows, TV Dramas","","6.2/10","38/100",1,0,0,0,"High",9,0.25,0.5
"TV Show","Zona Rosa","","Manu NNa, Ana Julia Yeyé, Ray Contreras, Pablo Morán","Mexico","November 26, 2019",2019,"TV-MA","1 Season","International TV Shows, Spanish-Language TV Shows, Stand-Up Comedy & Talk Shows","","6.0/10","34/100",1,0,0,0,"High",5,0.25,0.47
"TV Show","Dolly Parton's Heartstrings","","Dolly Parton, Julianne Hough, Kimberly Williams-Paisley, Dallas Roberts, Melissa Leo, Andy Mientus, Katie Stevens, Michael J. Willett, Aidan Langford, Ray McKinnon, Delta Burke, Gerald McRaney, Ben Lawson, Brooke Elliott, Michele Weaver, Tim Reid, Sarah Shahi, Rochelle Aytes, Jessica Collins, Tammy Lynn Michaels, Robert Taylor, Holly Taylor, Shane Paul McGhie, Mary Lane Haskell, Camryn Manheim, Bellamy Young, Patricia Wettig, Timothy Busfield, Tom Brittney, Virginia Gardner, Colin O'Donoghue, Willa Fitzgerald, David Denman, Vanessa Rubio, Mac Davis, Kathleen Turner, Ginnifer Goodwin, Kyle Bornheimer, Tyler Crumley, Mary Donnelly Haskell, Ed Amatrudo","United States","November 22, 2019",2019,"TV-14","1 Season","TV Dramas","16+","7.6/10","57/100",1,0,0,0,"Medium",5,0.25,0.665
"TV Show","Nailed It! Holiday!","","Nicole Byer, Jacques Torres","United States","November 22, 2019",2019,"TV-PG","2 Seasons","Reality TV","","7.7/10","49/100",1,0,0,0,"Low",5,0.25,0.63
"TV Show","Narcoworld: Dope Stories","","","United States","November 22, 2019",2019,"TV-MA","1 Season","Crime TV Shows, Docuseries","","6.6/10","41/100",1,0,0,0,"High",5,0.25,0.535
"TV Show","Nobody's Looking","","Victor Lamoglia, Júlia Rabello, Kéfera Buchmann, Augusto Madeira, Danilo de Moura, Leandro Ramos, Telma Souza, Priscila Sol, Wallie Ruy, Maurício de Barros, Hermínio Ribeiro","Brazil","November 22, 2019",2019,"TV-MA","1 Season","International TV Shows, TV Comedies, TV Dramas","18+","7.8/10","52/100",1,0,0,0,"High",5,0.25,0.65
"TV Show","Singapore Social","","Nicole Ong, Mae Tan, Sukki Singapora, Vinny Sharp, Paul Foster, Tabitha Nauser","Singapore, United States","November 22, 2019",2019,"TV-MA","1 Season","International TV Shows, Reality TV","","5.1/10","31/100",1,0,0,0,"High",5,0.25,0.41
"TV Show","The Dragon Prince","","Jack De Sena, Paula Burrows, Sasha Rojen, Jason Simpson, Racquel Belmonte, Jesse Inocalla, Luc Roderique, Jonathan Holmes, Adrian Petriw","United States, Canada","November 22, 2019",2019,"TV-Y7","3 Seasons","Kids' TV, TV Action & Adventure, TV Sci-Fi & Fantasy","7+","8.4/10","77/100",1,0,0,0,"Low",5,0.25,0.805
"TV Show","Trolls: The Beat Goes On!","","Amanda Leighton, Skylar Astin, Ron Funches, David Fynn, David Koechner, David Kaye, Sean T. Krishnan, Sam Lerner, Patrick Pinney, Kevin Michael Richardson, Kari Wahlgren, Fryda Wolff","United States","November 22, 2019",2019,"TV-Y7","8 Seasons","Kids' TV, TV Comedies","all","5.9/10","48/100",1,0,0,0,"Low",5,0.25,0.535
"TV Show","Bangkok Buddies","","Vayu Kessuvit, Ekapol Deebunmee, Nuttapong Boonyuen, Thanadol Auepongs, Martin Sidel, Nichaphat Chatchaipholrat, Narupornkamol Chaisang, Jidapa Siribunchawan, Hortnarong Teng, Everest Moe, Le Trung Hieu","Thailand","November 20, 2019",2019,"TV-MA","1 Season","International TV Shows, TV Comedies, TV Dramas","all","6.8/10","29/100",1,0,0,0,"High",5,0.25,0.485
"TV Show","Holiday Secrets","","Corinna Harfouch, Christiane Paul, Svenja Jung, Leonie Benesch, Anita Vulesica, Barbara Nüsse, Hans-Uwe Bauer, Lorna zu Solms, Tilda Jenkins, Emilie Neumeister, Golo Euler, Dennis Herrmann, Maik Solbach, Merlin Rose","Germany","November 20, 2019",2019,"TV-MA","1 Season","International TV Shows, TV Dramas","16+","6.5/10","44/100",1,0,0,0,"High",5,0.25,0.545
"TV Show","Who Killed Little Gregory?","","","France","November 20, 2019",2019,"TV-MA","1 Season","Crime TV Shows, Docuseries, International TV Shows","","7.4/10","55/100",1,0,0,0,"High",5,0.25,0.645
"TV Show","Miss Culinary","","Wanida Termthanaporn, Jason Young, Thanawin Teeraphosukarn, Thanabordee Jaiyen, Chonnikan Netjui, Passaranan Ussadamongkol, Janya Thanasawangkun, Jaturong Mokjok, Panadda Wongphudee️️","","November 19, 2019",2019,"TV-14","1 Season","International TV Shows, Romantic TV Shows, TV Comedies","","","36/100",1,0,0,0,"Medium",5,0.25,NA
"TV Show","Candy Online","","Ruby Zhan, Suun Lin, Sunnie Wang, Dean Tang, Lain Lu, Cheng Ko, Jacqueline Zhu, Chen Wen-shan, Ada Pan","Taiwan","November 17, 2019",2019,"TV-MA","1 Season","International TV Shows, TV Dramas, Teen TV Shows","","5.3/10","34/100",1,0,0,0,"High",5,0.25,0.435
"TV Show","I'm with the Band: Nasty Cherry","","Charli XCX, Emmie Lichtenberg, Gabbriette Bechtel, Chloe Chaidez, Deborah Knox- Hewson, Georgia Somary","United States","November 15, 2019",2019,"TV-MA","1 Season","Reality TV","","6.7/10","38/100",1,0,0,0,"High",5,0.25,0.525
"TV Show","Llama Llama","","Jennifer Garner, Shayle Simons, Vania Gill, Islie Hirvonen, Brendon Sunderland, Austin Abell, Evans Johnson, Kathleen Barr, David Hoole","United States","November 15, 2019",2019,"TV-Y","2 Seasons","Kids' TV","all","6.5/10","33/100",1,0,0,0,"Low",5,0.25,0.49
"TV Show","My MVP Valentine","","Angela Chang, Tony Sun, Johnny Yan, Margaret Lin, David Chen, Sam Wang, Zax Wang, Jason Hsu, Joe Chen","Taiwan","November 15, 2019",2002,"TV-PG","1 Season","International TV Shows, Romantic TV Shows, TV Dramas","","6.6/10","32/100",1,0,0,0,"Low",22,0.25,0.49
"TV Show","My Sassy Girl","","Joo Won, Oh Yeon-seo, Lee Jung-shin, Kim Yoon-hye, Sohn Chang-min, Yoon Se-a, Cho Hee-bong, Jung Woong-in, Lee Kyung-hwa","South Korea","November 15, 2019",2017,"TV-14","1 Season","International TV Shows, Korean TV Shows, Romantic TV Shows","","6.9/10","43/100",1,0,0,0,"Medium",7,0.25,0.56
"TV Show","The Club","","Alejandro Speitzer, Minnie West, Jorge Caballero, Ana González Bello, Axel Arenas, Arcelia Ramírez, Omar Germenos, Anna Ciocchetti, Aurora Gil, Martha Julia, Alejandro Puente, Estrella Solís, Martín Saracho, Sofía de Llaca, Marco Tostado","Mexico","November 15, 2019",2019,"TV-MA","1 Season","Crime TV Shows, International TV Shows, Spanish-Language TV Shows","18+","6.3/10","50/100",1,0,0,0,"High",5,0.25,0.565
"TV Show","The Stranded","","Papangkorn Lerkchaleampote, Chayanit Chansangavej, Chutavuth Pattarakampol, Kittisak Patomburana, Sinjai Plengpanich, Oabnithi Wiwattanawarang, Ticha Wongthipkanont, Chaleeda Gilbert, Chanya McClory","Thailand","November 15, 2019",2019,"TV-MA","1 Season","International TV Shows, TV Action & Adventure, TV Dramas","18+","6.3/10","50/100",1,0,0,0,"High",5,0.25,0.565
"TV Show","The Toys That Made Us","","","United States","November 15, 2019",2019,"TV-14","3 Seasons","Docuseries, Reality TV","16+","8.1/10","70/100",1,0,0,0,"Medium",5,0.25,0.755
"TV Show","Westside Story","","Tony Sun, Wallace Huo, Esther Liu, Cyndi Wang, Zax Wang, Sam Wang, Jason Hsu, Whyn Wu, Ben Lee, Vicky Chen","","November 15, 2019",2003,"TV-14","1 Season","International TV Shows, Romantic TV Shows, TV Action & Adventure","","","18/100",1,0,0,0,"Medium",21,0.25,NA
"TV Show","My Dear Warrior","","Leo Putt, Pimchanok Luevisadpaibul, Suthada Jongjaiphar, Chatra Baude, Claudia Chakrapan, Oabnithi Wiwattanawarang, Varatta Vajrathon, Varot Makaduangkeo, Supasit Chinvinijkul","Thailand","November 14, 2019",2019,"TV-14","1 Season","International TV Shows, Romantic TV Shows, TV Comedies","","3.9/10","33/100",1,0,0,0,"Medium",5,0.25,0.36
"TV Show","Maradona in Mexico","","Diego Armando Maradona","Argentina, United States, Mexico","November 13, 2019",2020,"TV-MA","1 Season","Docuseries, Spanish-Language TV Shows","","7.2/10","43/100",1,0,0,0,"High",4,0.25,0.575
"TV Show","Chief of Staff","","Lee Jung-jae, Shin Mina, Lee Elijah, Kim Dong-jun, Jung Jin-young, Kim Kap-soo, Jung Woong-in, Im Won-hee, Kim Hong-pa","South Korea","November 12, 2019",2019,"TV-14","2 Seasons","International TV Shows, Korean TV Shows, TV Dramas","16+","7.9/10","44/100",1,0,0,0,"Medium",5,0.25,0.615
"TV Show","Put Your Head on My Shoulder","","Fair Xing, Lin Yi, Daddi Tang, Yi Sha, Zhou Zixin, Zheng Yingchen, Cai Gang, Liang Aiqi, Rong Rong, He Qiang","China","November 11, 2019",2019,"TV-14","1 Season","International TV Shows, Romantic TV Shows, Teen TV Shows","7+","8.0/10","51/100",1,0,0,0,"Medium",5,0.25,0.655
"TV Show","Little Things","","Dhruv Sehgal, Mithila Palkar","India","November 9, 2019",2019,"TV-MA","3 Seasons","International TV Shows, Romantic TV Shows, TV Comedies","18+","8.3/10","61/100",1,0,0,0,"High",5,0.25,0.72
"TV Show","Green Eggs and Ham","","Michael Douglas, Adam Devine, Keegan-Michael Key, Eddie Izzard, Jillian Bell, Ilana Glazer, Diane Keaton, Jeffrey Wright, John Turturro, Tracy Morgan, Daveed Diggs","United Kingdom, Canada, United States","November 8, 2019",2019,"TV-Y7","1 Season","Kids' TV, TV Action & Adventure, TV Comedies","7+","8.2/10","63/100",1,0,0,0,"Low",5,0.25,0.725
"TV Show","Wild District","","Juan Pablo Raba, Cristina Umaña, Camila Sodi, Christian Tappán, Juan Fernando Sánchez, Juan Sebastián Calero, Paula Castaño, Nicolás Quiroga, Alina Lozano, Carolina Acevedo, Julio César Pachón, Roberto Cano","Colombia","November 8, 2019",2019,"TV-MA","2 Seasons","Crime TV Shows, International TV Shows, Spanish-Language TV Shows","18+","8.3/10","56/100",1,0,0,0,"High",5,0.25,0.695
"Movie","Shadow","Zhang Yimou","Deng Chao, Sun Li, Ryan Cheng, Wang Qianyuan, Hu Jun, Wang Jingchun, Guan Xiaotong, Leo Wu","China, Hong Kong","November 6, 2019",2018,"TV-14","116 min","Action & Adventure, Dramas, International Movies","7+","6.6/10","51/100",1,0,0,0,"Medium",6,0.25,0.585
"TV Show","Sam & Cat","","Jennette McCurdy, Ariana Grande, Cameron Ocasio, Brandon Weaver, Zoran Korach, Dre Swain, Maree Cheatham, Eduardo Drummond, Alondra Hidalgo","United States","November 5, 2019",2014,"TV-PG","2 Seasons","Kids' TV, TV Comedies","7+","5.7/10","59/100",1,0,0,0,"Low",10,0.25,0.58
"TV Show","The End of the F***ing World","","Jessica Barden, Alex Lawther, Steve Oram, Christine Bottomley, Navin Chowdhry, Wunmi Mosaku, Gemma Whelan, Jonathan Aris, Eileen Davies","United Kingdom","November 5, 2019",2019,"TV-MA","2 Seasons","British TV Shows, International TV Shows, TV Comedies","18+","8.1/10","85/100",1,0,0,0,"High",5,0.25,0.83
